15200,10/01/2026,Do you have a physical store ?,Free Text,a0eTm000001IUVJ,Premier Bet Chat EN,Any other Comments/Suggestions:,Premier Bet Zimbabwe Site Guest User
15198,10/01/2026,You take long to respond thats annoying,Free Text,a0eTm000001IULd,Premier Bet Chat EN,Any other Comments/Suggestions:,Premier Bet Malawi Site Guest User
15193,10/01/2026,My withdrawal is not working,Free Text,a0eTm000001IQ6j,Premierbet Email EN,Any other Comments/Suggestions:,Premier Bet Liberia Site Guest User
15190,09/01/2026,I have not received my money yet that I won from Jackpot what happened since them?,Free Text,a0eTm000001IPfJ,Premier Bet Chat EN,Any other Comments/Suggestions:,Premier Bet Liberia Site Guest User
15188,09/01/2026,It's great using premier,Free Text,a0eTm000001IPNZ,Premier Bet Chat EN,Any other Comments/Suggestions:,Premier Bet Zimbabwe Site Guest User
15187,09/01/2026,Delay response time,Free Text,a0eTm000001IPLx,Premier Bet Chat EN,Any other Comments/Suggestions:,Premier Bet Malawi Site Guest User
15186,09/01/2026,Need bonuses to work,Free Text,a0eTm000001IPKL,Premier Bet Chat EN,Any other Comments/Suggestions:,Premier Bet Zimbabwe Site Guest User
15185,09/01/2026,wengering limits are too high consider,Free Text,a0eTm000001IP5p,Premier Bet Chat EN,Any other Comments/Suggestions:,Premier Bet Malawi Site Guest User
15180,09/01/2026,The withdrawal part of premier bet needs to be changed it's giving us problems. We can't easily withdraw our funds as you always look for registration of payment method. Yet our numbers are already registered,Free Text,a0eTm000001INSD,Premier Bet Chat EN,Any other Comments/Suggestions:,Premier Bet Malawi Site Guest User
15178,09/01/2026,Time management slow to assist customer,Free Text,a0eTm000001IN5d,Premier Bet Chat EN,Any other Comments/Suggestions:,Premier Bet Malawi Site Guest User
15177,09/01/2026,"wating 19 mins and what he wanted talked and not listing what i wanted and then finish
i dont understand why you guys working like this?",Free Text,a0eTm000001IN41,Premier Bet Chat EN,Any other Comments/Suggestions:,Premier Bet Malawi Site Guest User
15161,09/01/2026,Hi it is just my personal details that are not correct like my id number and my date of birth  and my Gmail address so I want to correct my personal details.Thank you very much...,Free Text,a0eTm000001IEgf,Premier Bet Chat EN,Any other Comments/Suggestions:,Premier Bet Namibia Site Guest User
15158,09/01/2026,I will likely your service to be fast,Free Text,a0eTm000001IDuH,Premierbet Email EN,Any other Comments/Suggestions:,Premier Bet Zimbabwe Site Guest User
15145,08/01/2026,Fails on withdrawal,Free Text,a0eTm000001I7iQ,Premier Bet Chat EN,Any other Comments/Suggestions:,Premier Bet Zimbabwe Site Guest User
15142,08/01/2026,Premierbet it's best platform for rottery and have considerable agents,Free Text,a0eTm000001I7Gz,Premierbet Email EN,Any other Comments/Suggestions:,Premier Bet Malawi Site Guest User
15134,08/01/2026,I just want to appreciate premierBet.com for their confident put in us from difference location around the world and also for the customers care given to me today.I truly appreciate.,Free Text,a0eTm000001I5dN,Premierbet Email EN,Any other Comments/Suggestions:,Premier Bet Liberia Site Guest User
15133,08/01/2026,big problem,Free Text,a0eTm000001I5FB,Premier Bet Chat EN,Any other Comments/Suggestions:,Premier Bet Zimbabwe Site Guest User
15130,08/01/2026,Bad customer support services.,Free Text,a0eTm000001I3tJ,Premierbet Email EN,Any other Comments/Suggestions:,Premier Bet Malawi Site Guest User
15128,08/01/2026,Sort my issue,Free Text,a0eTm000001I2lx,Premierbet Email EN,Any other Comments/Suggestions:,Premier Bet Malawi Site Guest User
15124,08/01/2026,It's an awesome experience working with premier bet,Free Text,a0eTm000001I10H,Premierbet Email EN,Any other Comments/Suggestions:,Premier Bet Malawi Site Guest User
15122,08/01/2026,I want to use the bonus but I don't know how can I get it,Free Text,a0eTm000001I0Yr,Premier Bet Chat EN,Any other Comments/Suggestions:,Premier Bet Zimbabwe Site Guest User
15117,08/01/2026,am not helped,Free Text,a0eTm000001HzCz,Premier Bet Chat EN,Any other Comments/Suggestions:,Premier Bet Malawi Site Guest User
15106,08/01/2026,please help me how to use bonus points,Free Text,a0eTm000001HxeD,Premier Bet Chat EN,Any other Comments/Suggestions:,Premier Bet Malawi Site Guest User
15104,08/01/2026,Maybe find other quick ways of depositing.,Free Text,a0eTm000001Hwex,Premierbet Email EN,Any other Comments/Suggestions:,Premier Bet Zimbabwe Site Guest User
15102,08/01/2026,"You are not fair, Your systems are not good these days. Your aviator now is not user friendly, it usually goes offline and we lose money. Your Cashback that comes with wagering is also useless. Your rewards are also not fair, you make us spin the premier wheel, we win and you don't provide, yet your terms say instant.
In short , your services have gone down.",Free Text,a0eTm000001HxBB,Premierbet Email EN,Any other Comments/Suggestions:,Premier Bet Malawi Site Guest User
15101,08/01/2026,Keep up the good work,Free Text,a0eTm000001HwWr,Premierbet Email EN,Any other Comments/Suggestions:,Premier Bet Zimbabwe Site Guest User
15100,08/01/2026,My ticket won but you didn't pay me out,Free Text,a0eTm000001HwVF,Premierbet Email EN,Any other Comments/Suggestions:,Premier Bet Zimbabwe Site Guest User
15096,08/01/2026,There is need for promptness in rectifying qiuries,Free Text,a0eTm000001Ht7Z,Premierbet Email EN,Any other Comments/Suggestions:,Premier Bet Zimbabwe Site Guest User
15095,08/01/2026,"Since I won from Jackpot, I have not received my money yet please help me.",Free Text,a0eTm000001HrYn,Premier Bet Chat EN,Any other Comments/Suggestions:,Premier Bet Liberia Site Guest User
15088,07/01/2026,Let the bonus money also bet football matches,Free Text,a0eTm000001HqeL,Premier Bet Chat EN,Any other Comments/Suggestions:,Premier Bet Zimbabwe Site Guest User
15087,07/01/2026,I really appreciate you guys for the good work you are doing,Free Text,a0eTm000001Hqb7,Premier Bet Chat EN,Any other Comments/Suggestions:,Premier Bet Malawi Site Guest User
15086,07/01/2026,I really appreciate you guys for the good work  you are always helping us,Free Text,a0eTm000001HqZV,Premier Bet Chat EN,Any other Comments/Suggestions:,Premier Bet Malawi Site Guest User
15085,07/01/2026,Whenever I have a question to ask? I appreciate the staff that are working at premier bet they always assist me. I'm proud of you guys keep doing the great work,Free Text,a0eTm000001HqXt,Premier Bet Chat EN,Any other Comments/Suggestions:,Premier Bet Malawi Site Guest User
15084,07/01/2026,I want a make deposit,Free Text,a0eTm000001HqUf,Premier Bet Chat EN,Any other Comments/Suggestions:,Premier Bet Malawi Site Guest User
15082,07/01/2026,Deposit,Free Text,a0eTm000001HqPp,Premierbet Email EN,Any other Comments/Suggestions:,Premier Bet Zimbabwe Site Guest User
15072,07/01/2026,Everything is fine,Free Text,a0eTm000001HptZ,Premierbet Email EN,Any other Comments/Suggestions:,Premier Bet Zimbabwe Site Guest User
15071,07/01/2026,I didn't receive my money,Free Text,a0eTm000001Hpn7,Premier Bet Chat EN,Any other Comments/Suggestions:,Premier Bet Zimbabwe Site Guest User
15064,07/01/2026,Keep the good work,Free Text,a0eTm000001Hmyw,Premier Bet Chat EN,Any other Comments/Suggestions:,Premier Bet Zimbabwe Site Guest User
15056,07/01/2026,I was not given an immediate solution and this is my third time enquiring about the same problem,Free Text,a0eTm000001HmfZ,Premier Bet Chat EN,Any other Comments/Suggestions:,Premier Bet Malawi Site Guest User
15055,07/01/2026,Premier bet premier is truly helping us out in life . Thank you very much .,Free Text,a0eTm000001HmXV,Premier Bet Chat EN,Any other Comments/Suggestions:,Premier Bet Namibia Site Guest User
15050,07/01/2026,I appreciate your swift response to feedback. I requested for password reset but the password which was shared is wrong or failed to login. May you kindly assist! I have shared the details on email,Free Text,a0eTm000001Hlun,Premierbet Email EN,Any other Comments/Suggestions:,Premier Bet Zimbabwe Site Guest User
15049,07/01/2026,I appreciate the time and assistance provided by the support team.,Free Text,a0eTm000001HltB,Premierbet Email EN,Any other Comments/Suggestions:,Premier Bet Malawi Site Guest User
15046,07/01/2026,"I am still waiting to hear about my apparent winnings although it was small. I think there was a glitch when I tried to withdraw. Further I love to play with Premier Bet.
Thanks",Free Text,a0eTm000001HlZp,Premierbet Email EN,Any other Comments/Suggestions:,Premier Bet Zimbabwe Site Guest User
15045,07/01/2026,Wagering amounts are too much which makes us exhaust our funds before satisfying the wager amount,Free Text,a0eTm000001HlWb,Premierbet Email EN,Any other Comments/Suggestions:,Premier Bet Malawi Site Guest User
15042,07/01/2026,Still waiting for my problem to be solved,Free Text,a0eTm000001HksH,Premierbet Email EN,Any other Comments/Suggestions:,Premier Bet Liberia Site Guest User
15026,07/01/2026,No comments so far,Free Text,a0eTm000001Hj09,Premierbet Email EN,Any other Comments/Suggestions:,Premier Bet Zimbabwe Site Guest User
15020,07/01/2026,"Please sort this issue. Let it not look like a scam.  The team responsible for rewards hub section should be serious with work. A similar incident happened last year, I gave up after several attempts but I am not giving up on this one, this time.",Free Text,a0eTm000001Hhnx,Premier Bet Chat EN,Any other Comments/Suggestions:,Premier Bet Malawi Site Guest User
15015,07/01/2026,Improve speed to attend to account recovery concerns,Free Text,a0eTm000001Hgez,Premierbet Email EN,Any other Comments/Suggestions:,Premier Bet Malawi Site Guest User
15011,07/01/2026,It too long to be assisted as of my in case,Free Text,a0eTm000001HgS5,Premierbet Email EN,Any other Comments/Suggestions:,Premier Bet Malawi Site Guest User
15008,07/01/2026,Premierbet customer service is below standard,Free Text,a0eTm000001HdE5,Premierbet Email EN,Any other Comments/Suggestions:,Premier Bet Malawi Site Guest User
15006,07/01/2026,Nice company,Free Text,a0eTm000001Hd2n,Premier Bet Chat EN,Any other Comments/Suggestions:,Premier Bet Malawi Site Guest User
14994,07/01/2026,Aziyankha mwachangu,Free Text,a0eTm000001HbXF,Premier Bet Chat EN,Any other Comments/Suggestions:,Premier Bet Malawi Site Guest User
14988,06/01/2026,Help us if you can,Free Text,a0eTm000001Hb2b,Premierbet Email EN,Any other Comments/Suggestions:,Premier Bet Malawi Site Guest User
14985,06/01/2026,"Be helpful, don't be lazy , you know your games . You know where to find the information better than customers",Free Text,a0eTm000001HamT,Premier Bet Chat EN,Any other Comments/Suggestions:,Premier Bet Malawi Site Guest User
14967,06/01/2026,"The EFT funding is not satisfactory, it takes long to reflect on the account",Free Text,a0eTm000001HZgj,Premierbet Email EN,Any other Comments/Suggestions:,Premier Bet Zimbabwe Site Guest User
14963,06/01/2026,Can i withdraw bonus money,Free Text,a0eTm000001HYW9,Premier Bet Chat EN,Any other Comments/Suggestions:,Premier Bet Zimbabwe Site Guest User
14959,06/01/2026,The withdrawal process keeps saying ?Something went wrong?,Free Text,a0eTm000001HXtR,Premierbet Email EN,Any other Comments/Suggestions:,Premier Bet Liberia Site Guest User
14955,06/01/2026,Nil,Free Text,a0eTm000001HXAH,Premier Bet Chat EN,Any other Comments/Suggestions:,Premier Bet Malawi Site Guest User
14944,06/01/2026,Agent should please try to respond to costumer on time. Internet is time and data consuming,Free Text,a0eTm000001HUyo,Premier Bet Chat EN,Any other Comments/Suggestions:,Premier Bet Liberia Site Guest User
14922,06/01/2026,Please  make sure that  reward  are immediately sent to customer accounts  after  winning,Free Text,a0eTm000001HUkH,Premier Bet Chat EN,Any other Comments/Suggestions:,Premier Bet Malawi Site Guest User
14909,06/01/2026,Refund my money please my 4 50usd,Free Text,a0eTm000001HUNh,Premierbet Email EN,Any other Comments/Suggestions:,Premier Bet Zimbabwe Site Guest User
14905,06/01/2026,"Y'all thank for the work 
And the agent said my money will be sent with in 24 hours",Free Text,a0eTm000001HTOP,Premier Bet Chat EN,Any other Comments/Suggestions:,Premier Bet Liberia Site Guest User
14902,06/01/2026,Try to solve problems fast,Free Text,a0eTm000001HSyb,Premier Bet Chat EN,Any other Comments/Suggestions:,Premier Bet Malawi Site Guest User
14900,06/01/2026,Good customer service,Free Text,a0eTm000001HSdd,Premier Bet Chat EN,Any other Comments/Suggestions:,Premier Bet Namibia Site Guest User
14896,06/01/2026,very timely response thank you,Free Text,a0eTm000001HRUf,Premier Bet Chat EN,Any other Comments/Suggestions:,Premier Bet Malawi Site Guest User
14890,06/01/2026,Whatsapp chat will help,Free Text,a0eTm000001HQ2L,Premier Bet Chat EN,Any other Comments/Suggestions:,Premier Bet Zimbabwe Site Guest User
14887,06/01/2026,Give me the prize,Free Text,a0eTm000001HPxV,Premier Bet Chat EN,Any other Comments/Suggestions:,Premier Bet Malawi Site Guest User
14885,06/01/2026,Taking long to get response did not get assistance,Free Text,a0eTm000001HPuH,Premier Bet Chat EN,Any other Comments/Suggestions:,Premier Bet Zimbabwe Site Guest User
14881,06/01/2026,They did not give me a definite solution,Free Text,a0eTm000001HOYP,Premier Bet Chat EN,Any other Comments/Suggestions:,Premier Bet Malawi Site Guest User
14880,06/01/2026,Keep up the good work!,Free Text,a0eTm000001HOVB,Premierbet Email EN,Any other Comments/Suggestions:,Premier Bet Malawi Site Guest User
14876,06/01/2026,I was able to get the help I needed,Free Text,a0eTm000001HMpC,Premier Bet Chat EN,Any other Comments/Suggestions:,Premier Bet Malawi Site Guest User
14871,06/01/2026,"My account, my money , my time but you don't want to reopen my account",Free Text,a0eTm000001HL13,Premierbet Email EN,Any other Comments/Suggestions:,Premier Bet Malawi Site Guest User
14869,06/01/2026,Maybe if you can put something like a cashback if someone deposited and ddnt win but lost or a daily lucky wheel  so that people can visit your site daily and they can start depositing,Free Text,a0eTm000001HKjJ,Premierbet Email EN,Any other Comments/Suggestions:,Premier Bet Zimbabwe Site Guest User
14863,06/01/2026,No now,Free Text,a0eTm000001HKGH,Premier Bet Chat EN,Any other Comments/Suggestions:,Premier Bet Zimbabwe Site Guest User
14862,06/01/2026,Your customer care is below standard,Free Text,a0eTm000001HKD3,Premierbet Email EN,Any other Comments/Suggestions:,Premier Bet Malawi Site Guest User
14851,05/01/2026,the watsap contact center isn't helping us they work as they rely on others and as if they are unqualified,Free Text,a0eTm000001HHn3,Premierbet Email EN,Any other Comments/Suggestions:,Premier Bet Malawi Site Guest User
14846,05/01/2026,Shut up i want my money,Free Text,a0eTm000001HHbl,Premier Bet Chat EN,Any other Comments/Suggestions:,Premier Bet Zimbabwe Site Guest User
14842,05/01/2026,"Deposits takes time to reflect always, please improve on that one. Up to noq my deposit does not reflect",Free Text,a0eTm000001HGxR,Premierbet Email EN,Any other Comments/Suggestions:,Premier Bet Zimbabwe Site Guest User
14841,05/01/2026,"Deposits takes time to reflect always, please improve on that one",Free Text,a0eTm000001HGvp,Premierbet Email EN,Any other Comments/Suggestions:,Premier Bet Zimbabwe Site Guest User
14839,05/01/2026,Thanks to the Premier bet for  the big support.,Free Text,a0eTm000001HGm9,Premier Bet Chat EN,Any other Comments/Suggestions:,Premier Bet Namibia Site Guest User
14822,05/01/2026,Not assisted,Free Text,a0eTm000001HDrV,Premier Bet Chat EN,Any other Comments/Suggestions:,Premier Bet Malawi Site Guest User
14813,05/01/2026,this service is very useless,Free Text,a0eTm000001HD0H,Premier Bet Chat EN,Any other Comments/Suggestions:,Premier Bet Malawi Site Guest User
14811,05/01/2026,N/a,Free Text,a0eTm000001HCc5,Premierbet Email EN,Any other Comments/Suggestions:,Premier Bet Zimbabwe Site Guest User
14806,05/01/2026,The agent didn't even respond to any message,Free Text,a0eTm000001HCDt,Premier Bet Chat EN,Any other Comments/Suggestions:,Premier Bet Zimbabwe Site Guest User
14799,05/01/2026,I was not helped it took so long to reply but at the end nothing worked,Free Text,a0eTm000001H9fp,Premier Bet Chat EN,Any other Comments/Suggestions:,Premier Bet Malawi Site Guest User
14797,05/01/2026,I would have appreciated a more immediate solution,Free Text,a0eTm000001H9Kr,Premier Bet Chat EN,Any other Comments/Suggestions:,Premier Bet Malawi Site Guest User
14795,05/01/2026,May you attend to my problem as soon as possible for me tocontinue to use premier bets,Free Text,a0eTm000001H8lN,Premierbet Email EN,Any other Comments/Suggestions:,Premier Bet Zimbabwe Site Guest User
14794,05/01/2026,"Sometimes we query without a screenshot, you still need to help us because we complain valid issues but you request screenshots instead try checking your systems",Free Text,a0eTm000001H6F0,Premierbet Email EN,Any other Comments/Suggestions:,Premier Bet Malawi Site Guest User
14789,05/01/2026,No one attended to me.,Free Text,a0eTm000001H4Hx,Premier Bet Chat EN,Any other Comments/Suggestions:,Premier Bet Zimbabwe Site Guest User
14788,04/01/2026,Why premier bet removed in our region,Free Text,a0eTm000001H3Tx,Premier Bet Chat EN,Any other Comments/Suggestions:,Premier Bet Zimbabwe Site Guest User
14787,04/01/2026,My deposit money not on my account,Free Text,a0eTm000001H3KH,Mercury Bet Chat EN,Any other Comments/Suggestions:,Mercury International Site Guest User
14786,04/01/2026,James kamtsokota,Free Text,a0eTm000001H3If,Premier Bet Chat EN,Any other Comments/Suggestions:,Premier Bet Malawi Site Guest User
14783,04/01/2026,I didn't get my rejected withdrawals back,Free Text,a0eTm000001H3CD,Premier Bet Chat EN,Any other Comments/Suggestions:,Premier Bet Zimbabwe Site Guest User
14782,04/01/2026,"It takes alot of time to be assisted by an agent and they respond as if yhey dont know what they are saying also, maybe they know much and its hard to explain to someone like me",Free Text,a0eTm000001H3Ab,Premier Bet Chat EN,Any other Comments/Suggestions:,Premier Bet Malawi Site Guest User
14780,04/01/2026,"Agent rude
Didn't wait for me to type my problem
Fuck off",Free Text,a0eTm000001H37N,Premier Bet Chat EN,Any other Comments/Suggestions:,Premier Bet Malawi Site Guest User
14778,04/01/2026,Agent rude,Free Text,a0eTm000001H349,Premier Bet Chat EN,Any other Comments/Suggestions:,Premier Bet Malawi Site Guest User
14776,04/01/2026,Your agents should focus on understanding the customer to provide tailor made solutions not just responding with general responses.,Free Text,a0eTm000001H2zJ,Premier Bet Chat EN,Any other Comments/Suggestions:,Premier Bet Malawi Site Guest User
14774,04/01/2026,"I said do not send me free bets to test my patience. I play with my ney, leave me but these free bers should t be send and they neglect till the game is over. I k ow rules, if they say 1.5 and over then i put  ocer that you keep denying then why send the. Is 4.5 less than 1.5.  Ust  do not send your customers to test their patience, we give you money so do not test my account",Free Text,a0eTm000001H2w5,Premier Bet Chat EN,Any other Comments/Suggestions:,Premier Bet Malawi Site Guest User
14773,04/01/2026,No suggestion,Free Text,a0eTm000001H2uT,Premier Bet Chat EN,Any other Comments/Suggestions:,Premier Bet Namibia Site Guest User
14772,04/01/2026,"Customer care/service is very important please respond to necessary things on time
Thank you",Free Text,a0eTm000001H2rF,Premier Bet Chat EN,Any other Comments/Suggestions:,Premier Bet Namibia Site Guest User
14770,04/01/2026,Provide the account number to deposit,Free Text,a0eTm000001H2o1,Premier Bet Chat EN,Any other Comments/Suggestions:,Premier Bet Namibia Site Guest User
14769,04/01/2026,Your software or application is not use friendly especially on  playing the games .,Free Text,a0eTm000001H2mP,Premierbet Email EN,Any other Comments/Suggestions:,Premier Bet Zimbabwe Site Guest User
14768,04/01/2026,"I play a ticket day before yesterday , since then I haven't seen my slept",Free Text,a0eTm000001H2Xu,Mercury Bet Chat EN,Any other Comments/Suggestions:,Mercury International Site Guest User
14766,04/01/2026,"Mercury international is the only betting company I trusted and valued in this country, really appreciate what you guy's have been doing here in Sierra Leone",Free Text,a0eTm000001H2fx,Mercury Bet Chat EN,Any other Comments/Suggestions:,Mercury International Site Guest User
14765,04/01/2026,Premium is the best,Free Text,a0eTm000001H2eL,Premierbet Email EN,Any other Comments/Suggestions:,Premier Bet Zimbabwe Site Guest User
14764,04/01/2026,"Your process of withdraw money is not good at all, you must put your shops in all the town",Free Text,a0eTm000001H2b7,Premier Bet Chat EN,Any other Comments/Suggestions:,Premier Bet Namibia Site Guest User
14762,04/01/2026,You should be able to assist customers who closed their accounts to reopen them.,Free Text,a0eTm000001H2WH,Premier Bet Chat EN,Any other Comments/Suggestions:,Premier Bet Malawi Site Guest User
14761,04/01/2026,hh,Free Text,a0eTm000001H2Pp,Mercury Bet Chat EN,Any other Comments/Suggestions:,Mercury International Site Guest User
14758,04/01/2026,You are the best but you need to fix unnecessary glitches,Free Text,a0eTm000001H2G9,Premierbet Email EN,Any other Comments/Suggestions:,Premier Bet Zimbabwe Site Guest User
14757,04/01/2026,Good information,Free Text,a0eTm000001H2EX,Premier Bet Chat EN,Any other Comments/Suggestions:,Premier Bet Namibia Site Guest User
14756,04/01/2026,The game between Olympiacos and Crete ended 3:0 but my ticket is showing x,Free Text,a0eTm000001H2Cv,Premier Bet Chat EN,Any other Comments/Suggestions:,Premier Bet Malawi Site Guest User
14753,04/01/2026,U are the best,Free Text,a0eTm000001H1lW,Premier Bet Chat EN,Any other Comments/Suggestions:,Premier Bet Zimbabwe Site Guest User
14752,04/01/2026,It's very good but some conditions it gives are too much,Free Text,a0eTm000001H21d,Premier Bet Chat EN,Any other Comments/Suggestions:,Premier Bet Zimbabwe Site Guest User
14750,04/01/2026,My bonus reflected in my account and disapper,Free Text,a0eTm000001H1lV,Premier Bet Chat EN,Any other Comments/Suggestions:,Premier Bet Zimbabwe Site Guest User
14749,04/01/2026,How can l play bonus on my account,Free Text,a0eTm000001H12L,Premier Bet Chat EN,Any other Comments/Suggestions:,Premier Bet Zimbabwe Site Guest User
14743,03/01/2026,Update account number details,Free Text,a0eTm000001GzIH,Premierbet Email EN,Any other Comments/Suggestions:,Premier Bet Malawi Site Guest User
14742,03/01/2026,Shit is fucked up,Free Text,a0eTm000001GzDR,Premier Bet Chat EN,Any other Comments/Suggestions:,Premier Bet Liberia Site Guest User
14741,03/01/2026,Money in my account,Free Text,a0eTm000001GzBp,Premier Bet Chat EN,Any other Comments/Suggestions:,Premier Bet Zimbabwe Site Guest User
14737,03/01/2026,Late replies by your agents,Free Text,a0eTm000001Gz0X,Premierbet Email EN,Any other Comments/Suggestions:,Premier Bet Malawi Site Guest User
14732,03/01/2026,Add more games in the casino section,Free Text,a0eTm000001Gynd,Premierbet Email EN,Any other Comments/Suggestions:,Premier Bet Zimbabwe Site Guest User
14729,03/01/2026,"I want assist on how to use a slot welcome 
bonuse",Free Text,a0eTm000001GyfZ,Premier Bet Chat EN,Any other Comments/Suggestions:,Premier Bet Malawi Site Guest User
14723,03/01/2026,You're the best bet,Free Text,a0eTm000001GySf,Premierbet Email EN,Any other Comments/Suggestions:,Premier Bet Malawi Site Guest User
14722,03/01/2026,Don't ignore us,Free Text,a0eTm000001GyPR,Premier Bet Chat EN,Any other Comments/Suggestions:,Premier Bet Malawi Site Guest User
14721,03/01/2026,I failed to attach the screenshots I was supposed to send to the agent because the attachment log just disappeared,Free Text,a0eTm000001GyNp,Premier Bet Chat EN,Any other Comments/Suggestions:,Premier Bet Malawi Site Guest User
14720,03/01/2026,Premier bet liberia is the best betting platform in Africa,Free Text,a0eTm000001GyMD,Premier Bet Chat EN,Any other Comments/Suggestions:,Premier Bet Liberia Site Guest User
14717,03/01/2026,Good service,Free Text,a0eTm000001GyFl,Premier Bet Chat EN,Any other Comments/Suggestions:,Premier Bet Malawi Site Guest User
14716,03/01/2026,"Your "" Customer support"" agents aren't very supportive.",Free Text,a0eTm000001Gxje,Premierbet Email EN,Any other Comments/Suggestions:,Premier Bet Zimbabwe Site Guest User
14715,03/01/2026,I do not appreciate my claim being sidelined and being gaslighted by a platform I have grown to trust. Take accountability for your mistakes otherwise your platform will not grow cause people will run from it if they face problems and the platform doesn't do anything about it,Free Text,a0eTm000001Gxa1,Premierbet Email EN,Any other Comments/Suggestions:,Premier Bet Zimbabwe Site Guest User
14710,03/01/2026,Don't make withdrawals too complicated and stop blocking network when you know that someone has placed automatic stake that will help them get more money,Free Text,a0eTm000001GvOL,Premier Bet Chat EN,Any other Comments/Suggestions:,Premier Bet Malawi Site Guest User
14708,02/01/2026,Am waiting for my bonuse,Free Text,a0eTm000001Gv9p,Premier Bet Chat EN,Any other Comments/Suggestions:,Premier Bet Malawi Site Guest User
14703,02/01/2026,Withdrawals should happen without problems,Free Text,a0eTm000001GunF,Premierbet Email EN,Any other Comments/Suggestions:,Premier Bet Malawi Site Guest User
